<?xml version="1.0" encoding="UTF-8"?>
<pack_manifest xmlns:xsi="http://www.w3.org/2001/XMLSchema-instance"
				xsi:noNamespaceSchemaLocation="schemas/pack_manifest.xsd"
				pack_id="core">
  <version>1</version>
  <defs>
	<file>defs/surfaces.xml</file>
	<file>defs/biomes.xml</file>
	<file>defs/seasons.xml</file>
	<file>defs/weather.xml</file>
	<file>defs/plants.xml</file>
	<file>defs/plant_groups.xml</file>
	<file>defs/tools.xml</file>
	<file>defs/buildings.xml</file>
	<file>defs/recipes.xml</file>
	<file>defs/items.xml</file>
	<file>defs/interactions.xml</file>
	<file>defs/ui_strings.xml</file>
	<file>defs/ui_assets.xml</file>
	<file>defs/planet_presets.xml</file>
  </defs>
  <schemas>
	<file>schemas/surfaces.xsd</file>
	<file>schemas/biomes.xsd</file>
	<file>schemas/seasons.xsd</file>
	<file>schemas/weather.xsd</file>
	<file>schemas/plants.xsd</file>
	<file>schemas/plant_groups.xsd</file>
	<file>schemas/tools.xsd</file>
	<file>schemas/buildings.xsd</file>
	<file>schemas/recipes.xsd</file>
	<file>schemas/items.xsd</file>
	<file>schemas/interactions.xsd</file>
	<file>schemas/ui_strings.xsd</file>
	<file>schemas/ui_assets.xsd</file>
	<file>schemas/planet_presets.xsd</file>
	<file>schemas/manifest.xsd</file>
	<file>schemas/pack_manifest.xsd</file>
	<file>schemas/points_of_interest.xsd</file>
	<file>schemas/rivers.xsd</file>
	<file>schemas/terrain_features.xsd</file>
  </schemas>
  <stamps>
	<file>stamps/points_of_interest.xml</file>
	<file>stamps/rivers.xml</file>
	<file>stamps/terrain_features.xml</file>
  </stamps>
</pack_manifest>
